{
    "$schema": "../../schemas/demo.schema.json",
    "slug": "star-button",
    "title": "Star button",
    "description": "A button for starring an item, with a counter. The star morphs into a filled one when you press it, and the count goes up.",
    "group": "buttons",
    "stage": "small",
    "icons": ["star"],
    "fragments": [
        {
            "id": "setup",
            "file": "main.ts",
            "region": "setup",
            "lang": "ts",
            "title": "Define the element",
            "note": "Built-in triggers only. What each icon follows is written in its markup."
        },
        {
            "id": "markup",
            "file": "index.html",
            "region": "markup",
            "lang": "html",
            "title": "The button and its icon",
            "note": "Press it, and the star fills and the count goes up, all from aria-pressed."
        },
        {
            "id": "wiring",
            "file": "main.ts",
            "region": "wiring",
            "lang": "ts",
            "title": "Flip the attribute on click",
            "note": "No lock, and no mention of an icon."
        },
        {
            "id": "colour",
            "file": "star-button.css",
            "region": "colour",
            "lang": "css",
            "title": "Colour from the same attribute",
            "note": "One custom property, four states. The icon inherits it through current-color."
        }
    ]
}
