{
    "$schema": "../../schemas/demo.schema.json",
    "slug": "categories-section",
    "title": "Categories section",
    "description": "Three rows of category chips that scroll without end, the middle one the other way. A row stops under the pointer, and the chip’s icon plays.",
    "group": "navigation",
    "stage": "large",
    "icons": [
        "camera-solid",
        "video-camera-solid",
        "layers-solid",
        "grid-bento-solid",
        "pencil-solid",
        "image-mountain-solid",
        "file-text-solid",
        "article-solid",
        "microphone-solid",
        "code-solid",
        "http-solid",
        "api-solid",
        "bar-chart-vertical-grow-solid",
        "arrow-trending-up-solid",
        "piggy-bank-solid",
        "calculator-simple-solid",
        "cart-solid",
        "email-solid",
        "globe-solid",
        "location-pin-solid",
        "pizza-slice-solid",
        "person-cycling-solid",
        "swimming-pool-solid",
        "home-solid",
        "pet-print-solid",
        "dice-one-solid"
    ],
    "fragments": [
        {
            "id": "setup",
            "file": "main.ts",
            "region": "setup",
            "lang": "ts",
            "title": "Define the element",
            "note": "Built-in triggers only. The rest of the script is one call that scrolls the rows."
        },
        {
            "id": "markup",
            "file": "index.html",
            "region": "markup",
            "lang": "html",
            "title": "A row of chips",
            "note": "Hovering anywhere on a chip plays its icon. Copies of the set fill the loop."
        },
        {
            "id": "scroll",
            "file": "categories-section.css",
            "region": "scroll",
            "lang": "css",
            "title": "Slide by one set, then start over",
            "note": "One number moves the whole row, so the loop never shows a seam."
        },
        {
            "id": "frame",
            "file": "../../shared/motion/marquee.ts",
            "region": "frame",
            "lang": "ts",
            "title": "Slow to a stop, then pick up",
            "note": "One loop moves every row at its own rate. The rate eases to 0 under the pointer or keyboard focus, and back to 1 after."
        },
        {
            "id": "colour",
            "file": "categories-section.css",
            "region": "colour",
            "lang": "css",
            "title": "Chip colours",
            "note": "One custom property per chip. Hover mixes it with black."
        }
    ]
}
