{
    "$schema": "../../schemas/demo.schema.json",
    "slug": "add-new-card",
    "title": "Add new card",
    "description": "An empty, dashed tile for adding a new item to a grid. Its plus icon turns when you hover over it.",
    "group": "cards",
    "stage": "small",
    "icons": ["plus"],
    "fragments": [
        {
            "id": "setup",
            "file": "main.ts",
            "region": "setup",
            "lang": "ts",
            "title": "Define the element",
            "note": "The whole script."
        },
        {
            "id": "markup",
            "file": "index.html",
            "region": "markup",
            "lang": "html",
            "title": "The tile",
            "note": "target points the icon at the tile, so the whole tile is the hover area."
        },
        {
            "id": "colour",
            "file": "add-new-card.css",
            "region": "colour",
            "lang": "css",
            "title": "Resting and hovered",
            "note": "Five custom properties set twice. The icon colour is one of them."
        }
    ]
}
